{
  "$schema": "http://json-schema.org/draft-07/schema#",
  "title": "VaultContentItem",
  "description": "Represents a single encrypted item stored within a vault.",
  "type": "object",
  "properties": {
    "contentId": {
      "description": "The unique identifier for this content item (exposed ID). This is an Internet Computer Principal identifier represented as a string.",
      "type": "string",
      "examples": ["bbbbb-bbbbb-bbbbb-bbbbb-bbbbb-bbbbb-bbbbb-bbbbb-bbbbb-bbbbb-bbb"]
    },
    "vaultId": {
      "description": "The Principal identifier (string) of the vault this content belongs to.",
      "type": "string"
    },
    "id": { "type": "string" },
    "type": {
      "type": "string",
      "enum": ["file", "password", "letter"]
    },
    "title": { "type": "string" },
    "created_at": { "type": "integer" },
    "updated_at": { "type": "integer" },

    "file_meta": {
      "type": "object",
      "properties": {
        "filename": { "type": "string" },
        "size_bytes": { "type": "integer" },
        "mime_type": { "type": "string" },
        "checksum": { "type": "string", "comment": "SHA256" } 
      },
      "required": ["filename", "size_bytes", "mime_type", "checksum"]
    },

    "password_entry": {
      "type": "object",
      "properties": {
        "label": { "type": "string" },
        "username": { "type": "string" },
        "password": { "type": "string" },
        "note": { "type": "string" }
      },
      "required": ["label", "password"]
    },

    "letter": {
      "type": "object",
      "properties": {
        "to": { 
          "type": "array",
          "items": {
            "type": "string"
          }
        },
        "message": { "type": "string" }
      },
      "required": ["message"]
    }
  },
  "required": ["id", "type", "created_at"],
  "additionalProperties": false
}