{
    "id": "content-002",
    "type": "password",
    "title": "Crypto Wallet",
    "created_at": 1713456100,
    "updated_at": 1713456100,
    "password_entry": {
      "label": "Binance Login",
      "username": "user@example.com",
      "password": "encrypted-data-here",
      "note": "2FA code stored on Authy"
    }
  }